dc:title,index,citedby-count,n-references
Nutri-Score: A public health tool to improve eating habits in Portugal Nutri-Score: Uma ferramenta de saúde pública para melhorar os hábitos alimentares da população Portuguesa,455,11,10.0
"Responses to the Chilean law of food labeling and advertising: Exploring knowledge, perceptions and behaviors of mothers of young children",458,112,29.0
Nutri-Score: towards a victory of public health? Nutri-Score : vers une victoire de la santé publique ?,459,0,0.0
Food choice under five front-of-package nutrition label conditions: An experimental study across 12 countries,464,50,33.0
Impact of different front-of-pack nutrition labels on foods according to their nutritional quality: A comparative study in Mexico Impacto de diferentes etiquetados frontales de alimentos según su calidad nutricional: Estudio comparativo en México,466,3,23.0
Comparison of front-of-pack labels to help German consumers understand the nutritional quality of food products: Color-coded labels outperform all other systems Vergleich von Front-of-Pack-Kennzeichnungen zur Aufklärung deutscher VerbraucherInnen über den Nährwert von Lebensmitteln: Farbkodierte Kennzeichnungen übertreffen alle anderen Systeme,467,13,25.0
Front-of-pack labeling and the nutritional quality of students’ food purchases: A 3-arm randomized controlled trial,469,28,27.0
Analysing the use of the Australian Health Star Rating system by level of food processing,471,26,41.0
A randomized trial assessing the effects of health claims on choice of foods in the presence of front-of-pack labels,473,17,43.0
Do manufacturer 'nutrient claims' influence the efficacy of mandated front-of-package labels?,474,24,39.0
A citizen perspective on nutritional warnings as front-of-pack labels: Insights for the design of accompanying policy measures,475,29,45.0
The impact of front-of-package label design on consumer understanding of nutrient amounts,476,51,37.0
Objective understanding of front-of-package nutrition labels: An international comparative experimental study across 12 countries,478,160,47.0
Influence of front-of-package nutrition labels on beverage healthiness perceptions: Results from a randomized experiment,482,24,42.0
Comparison of nutrient profiling models for assessing the nutritional quality of foods: A validation study,483,51,23.0
Impact of front-of-pack nutrition labels on portion size selection: An experimental study in a French cohort,484,27,21.0
Nutritional quality of food as represented by the FSAm-NPS nutrient profiling system underlying the Nutri-Score label and cancer risk in Europe: Results from the EPIC prospective cohort study,485,56,41.0
Association between mediterranean anti-inflammatory dietary profile and severity of psoriasis: Results from the NutriNet-Santé cohort,486,63,43.0
Comparative performance of three interpretative front-of-pack nutrition labelling schemes: Insights for policy making,488,88,59.0
Objective understanding of Nutri-Score Front-Of-Package nutrition label according to individual characteristics of subjects: Comparisons with other format labels,489,69,52.0
"The impact of the australasian ‘health star rating’, front-of-pack nutritional label, on consumer choice: A longitudinal study",490,17,48.0
Examining the nutritional quality of canadian packaged foods and beverages with and without nutrition claims,493,26,37.0
Traffic Light System Can Increase Healthfulness Perception: Implications for Policy Making,494,23,40.0
Promoting public health in nutrition: Nutri-Score and the tug of war between public health and the food industry,495,7,1.0
"Comparison of two front-of-package nutrition labeling schemes, and their explanation, on consumers’ perception of product healthfulness and food choice",497,23,39.0
Product reformulation in the context of nutritional warning labels: Exploration of consumer preferences towards food concepts in three food categories,498,32,58.0
Front-of-pack Nutri-Score labelling in France: an evidence-based policy,502,68,7.0
Influence of time orientation on food choice: Case study with cookie labels,503,20,50.0
Big Food’s Opposition to the French Nutri-Score Front-of-Pack Labeling Warrants a Global Reaction,504,17,5.0
Nutri-Score: multinationals are still opposed to scientific evidence Nutri-Score : des multinationales s’opposent encore aux évidences scientifiques,505,0,0.0
Comparing five front-of-pack nutrition labels’ influence on consumers’ perceptions and purchase intentions,507,68,32.0
The impact of interpretive and reductive front-of-pack labels on food choice and willingness to pay,508,61,58.0
Nutrition warnings as front-of-pack labels: Influence of design features on healthfulness perception and attentional capture,509,62,21.0
Making sense of the “clean label” trends: A review of consumer food choice behavior and discussion of industry implications,511,566,170.0
Warnings as a directive front-of-pack nutrition labelling scheme: Comparison with the Guideline Daily Amount and traffic-light systems,512,118,47.0
Impact of front-of-pack nutrition information and label design on children's choice of two snack foods: Comparison of warnings and the traffic-light system,514,121,61.0
Effects of a voluntary front-of-pack nutrition labelling system on packaged food reformulation: The health star rating system in New Zealand,515,90,20.0
Uses of nutrient profiling to address public health needs: From regulation to reformulation,516,40,36.0
Incorporating added sugar improves the performance of the health star rating front-of-pack labelling system in Australia,517,18,13.0
"The relative ability of different front-of-pack labels to assist consumers discriminate between healthy, moderately healthy, and unhealthy foods",518,38,12.0
"Perception of different formats of front-of-pack nutrition labels according to sociodemographic, lifestyle and dietary factors in a French population: Cross-sectional study among the NutriNet-Santé cohort participants",519,59,55.0
Are self-reported unhealthy food choices associated with an increased risk of breast cancer? Prospective cohort study using the British Food Standards Agency nutrient profiling system,520,30,37.0
Modifications of food purchases in response to five nutrition simplified labelling Modification des achats alimentaires en réponse à cinq logos nutritionnels,521,26,15.0
Color-coded front-of-pack nutrition labels—an option for US packaged foods?,522,6,21.0
Association between a dietary quality index based on the food standard agency nutrient profiling system and cardiovascular disease risk among French adults,523,37,43.0
Front-of-pack nutrition label NutriScore: An useful public health tool for Spanish consumers El logotipo nutricional NutriScore en los envases de los alimentos puede ser una herramienta útil para los consumidores españoles,524,2,34.0
Children and adolescents' attitudes towards sugar reduction in dairy products,525,17,54.0
Consumer Perception of the Healthfulness of Ultra-processed Products Featuring Different Front-of-Pack Nutrition Labeling Schemes,526,31,45.0
Impact of explained v. unexplained front-of-package nutrition labels on parent and child food choices: A randomized trial,527,31,36.0
Understanding and acceptability by Hispanic consumers of four front-of-pack food labels,528,40,56.0
The types and aspects of front-of-pack food labelling schemes preferred by adults and children,530,50,60.0
Do health claims and front-of-pack labels lead to a positivity bias in unhealthy foods?,535,65,67.0
Does a time constraint modify results from rating-based conjoint analysis? Case study with orange/pomegranate juice bottles,536,4,55.0
Prospective association between a dietary quality index based on a nutrient profiling system and cardiovascular disease risk,538,52,36.0
Impact of the front-of-pack 5-colour nutrition label (5-CNL) on the nutritional quality of purchases: An experimental study,539,57,39.0
Helping consumers with a front-of-pack label: Numbers or colors?: Experimental comparison between Guideline Daily Amount and Traffic Light in a diet-building exercise,540,36,15.0
A nutrient profiling assessment of packaged foods using two star-based front-of-pack labels,541,16,18.0
Motives Underlying Food Choice for Children and Perception of Nutritional Information Among Low-Income Mothers in a Latin American Country,543,34,41.0
Consumer responses to three nutrition “Front-of-Pack” labeling systems Réponses des consommateurs à trois systèmes d’étiquetage nutritionnel face avant,545,24,17.0
The 5-CNL front-of-pack nutrition label appears an effective tool to achieve food substitutions towards healthier diets across dietary profiles,546,16,33.0
Does the Australasian “health star rating” front of pack nutritional label system work?,547,61,30.0
Impact of different front-of-pack nutrition labels on consumer purchasing intentions: A randomized controlled trial,549,130,37.0
Performance of a five category front-of-pack labelling system - The 5-colour nutrition label - To differentiate nutritional quality of breakfast cereals in France,557,41,39.0
"Front of Pack Nutrition Labelling, Nutrition, Quality and Consumer Choices",558,17,32.0
The impact of front-of-pack nutrition labels on consumer product evaluation and choice: An experimental study,559,46,17.0
Prospective association between cancer risk and an individual dietary index based on the British Food Standards Agency Nutrient Profiling System,562,42,34.0
Discriminating nutritional quality of foods using the 5-Color nutrition label in the French food market: Consistency with nutritional recommendations,564,46,21.0
Objective understanding of front-of-package nutrition labels among nutritionally at-risk individuals,566,75,42.0
Consumer support for healthy food and drink vending machines in public places,567,33,10.0
Influence of cognitive style on information processing and selection of yogurt labels: Insights from an eye-tracking study,568,52,50.0
"Influence of interpretation aids on attentional capture, visual processing, and understanding of front-of-package nutrition labels",573,59,32.0
Front-of-pack symbols are not a reliable indicator of products with healthier nutrient profiles,575,19,19.0
Understanding front-of-pack nutrition labels De la compréhension des logos d'information nutritionnelle,578,0,8.0
FoodSwitch: A mobile phone app to enable consumers to make healthier food choices and crowdsourcing of national food composition data,580,159,11.0
When zero is greater than one: Consumer misinterpretations of nutrition labels,582,15,18.0
Attentional capture and importance of package attributes for consumers' perceived similarities and differences among products: A case study with breakfast cereal packages,583,48,45.0
Adolescents' ability to select healthy food using two different front-of-pack food labels: A cross-over study,584,25,26.0
Influence of rational and intuitive thinking styles on food choice: Preliminary evidence from an eye-tracking study with yogurt labels,587,96,59.0
